{
  "artifact_sha256": "3333333333333333333333333333333333333333333333333333333333333333",
  "build_commit": "0000000000000000000000000000000000000000",
  "config_bundle_sha256": "2222222222222222222222222222222222222222222222222222222222222222",
  "contract_manifest_sha256": "1111111111111111111111111111111111111111111111111111111111111111",
  "emitted_at_us": 1786156800123456,
  "event_id": "evt_triad_venue_execution_plan_v1",
  "event_kind": "VENUE_EXECUTION_PLAN",
  "payload": {
    "account_mode": "x-mode",
    "authorization_ref": "x-authorization",
    "economic_purpose": "x-purpose",
    "idempotency_key_law": "x-law",
    "instrument_id": "x-instrument",
    "observed_book": {
      "levels": [
        {
          "price_ticks": "101",
          "qty_steps": "5"
        }
      ],
      "revision": "1"
    },
    "ordinal_budget": 0,
    "price_bands": {},
    "price_filters": {},
    "refusal_codes": [],
    "reprice_budget": "1",
    "side": "BUY",
    "ttl_ms": "1000",
    "zone": {
      "z0": "100",
      "z1": "90"
    }
  },
  "producer_epoch": "42",
  "producer_instance_id": "inst_golden_01",
  "producer_service": "triad-e08",
  "schema": "triad.venue_execution_plan.v1",
  "schema_version": "1.0.0"
}
